<?xml version="1.0" encoding="UTF-8"?>
<schema xmlns="http://www.w3.org/2001/XMLSchema" 
	targetNamespace="http://www.library.epam.com/commandList" 
	xmlns:tns="http://www.library.epam.com/commandList" 
	elementFormDefault="qualified"
	attributeFormDefault="unqualified">
	
	<element name="commandList">
		<complexType>
			<sequence>
				<element name="command" type="tns:CommandType" minOccurs="1" maxOccurs="15" />
			</sequence>		
		</complexType>	
	</element>
	
	<complexType name="CommandType">
		<sequence>			
			<element name="path" type="tns:PathType" minOccurs="1"/>						
		</sequence>
		 <attribute name="name" type="string" use="required"/>
	</complexType>		
    
    <simpleType name="PathType">
        <restriction base="string">
            <pattern value="com.epam.library.controller.command.impl.[-_a-zA-Z]+"/>
        </restriction>
    </simpleType>	
</schema>